id,vader_neg,vader_neu,vader_pos,vader_compound,name,rating,verified,date,title,body,like,dislike
67,0.069,0.876,0.054,-0.128,Ann,2,True,17/01/2024,Did not meet my expectations,I returned the cup.  The top that holds the straw was loose and the straw was not the straw that comes with Stanley cups.  I returned the merchandise and am awaiting my refund.,0,0
68,0.197,0.749,0.054,-0.5851,Amber,1,True,14/01/2024,Knock off,"This was not a Stanley was a clear knock off. Was light weight, lid didn't fit, straw was a cheap plastic one, handle placement was off and top plastic piece was loose",0,0
69,0.089,0.852,0.059,-0.3595,Hannah,1,True,02/01/2024,Not worth the hype,"The worst cup that doesn't keep cold drinks. 
I have a simple modern 40oz cup that is only $30 and keeps my coffee cold with ice til a good 3/4 pm. This cup by 11 am was all water down 🤢 ewwwwwwww! Over priced and doesn't even work",0,0
70,0.0,0.58,0.42,0.4404,Doris,1,True,06/07/2024,Didn't get the merchandise it was sent somewhere,Hope they get there order,0,0
71,0.171,0.829,0.0,-0.4767,PapaBear,1,True,11/07/2024,Fake,Returning… doesn't match another Stanley Cup that I have. It has all the signs of being fake.,0,0
72,0.0,0.909,0.091,0.0772,frankie,5,True,12/07/2024,amazing,it  keeps water cold for awhile and that is what i want from a water bottle,0,0
73,0.0,0.469,0.531,0.88,denise,5,True,02/07/2024,Great,"Was sent the item with a small gift inside! 
Loved it ! Thank you!🥰",0,0
74,0.0,0.549,0.451,0.8118,KimH,5,False,29/12/2023,Great Christmas gift,This was a Christmas gift for my daughter and she loved it!!,0,0
75,0.11,0.609,0.281,0.6696,ChanelR,5,False,03/01/2024,Dirty Santa gift!,Love it. Was dirty Santa gift. Big hit! Husband and kids and I each got one after seeing this one.,0,0
76,0.0,0.841,0.159,0.3506,LadyR,5,False,24/11/2023,Cute,Its design is beautiful. but it filters. so its functionality must be worked on.,0,0
77,0.0,0.9,0.1,0.2732,LoriV,2,False,18/09/2023,Poor material quality,"After 2 weeks of use it started chipping. I got a replacement, same thing. I hand wash them but the material doesn't hold up b",0,0
78,0.0,0.898,0.102,0.3818,ShannonS,3,False,12/08/2023,40oz review,Love the cup but it doesn't take long for the material to start peeling off. They need to do something so this doesn't happen,0,0
79,0.163,0.574,0.263,0.6486,juliep,3,False,17/09/2023,Cold drinks but ugly cup from chipping,"Within a week of having this amazing cup, it started chipping. Love the cup- sad about the appearance and lack of quality matte finish.",0,0
80,0.0,0.477,0.523,0.9354,Stlmom,5,True,07/06/2024,Gift for my family,It was a gift for my niece but she loves it! Excited to find it at a good price.,0,0
81,0.0,0.627,0.373,0.9059,JoseG,4,False,23/07/2023,Great purchase,"I purchased the matte, great cup! Love the handle! Only reason I did not give it 5 stars is because it scuffs easily if dropped.",0,0
82,0.0,1.0,0.0,0.0,VictoriaW,2,False,16/08/2023,Coating chips and peels,The matte coating started to peel and chip off almost immediately. Not the quality I have come to expect from Stanley,0,0
83,0.137,0.863,0.0,-0.4344,MackennaH,5,False,13/08/2023,Only the best.,It's my first Stanley and I'm obsessed with the soft matte feel. I have it in the lilac color. LOVE!!!!,0,0
84,0.0,0.591,0.409,0.9149,Stanleyloverrrr,5,False,11/11/2023,"THeY aRrrreee LifE ChanGing!!! 500,000,000/5",WE loVe aRE sTanLeY CuPsssssss ThEy ArEeeee ThE BesT. THeY Fit iN CUp HoLDeRssss!!! AlSo TheY keeP aRE waTer CoLdddddd.,0,0
85,0.12,0.816,0.064,-0.3802,Butterflygirl25,1,True,17/01/2024,Phony Stanley,This was a replica Stanley and shame on the company who intentionally sold it for top dollar and not mention it in the description. I returned it!,0,0
86,0.166,0.834,0.0,-0.5255,Nicole,1,True,06/01/2024,FAKE!,"DO NOT BUY! Item is a fake knock-off and was not the “matte” version, as advertised. Ended up returning.",0,0
87,0.092,0.725,0.183,0.9343,Anonymous,2,False,04/07/2023,Buyer Beware,"It will chip.
The cup is great, fits in most cup holders and keeps things relatively cold (haven't tried anything warm). But no matter how cautious you are it will chip, and it's not going to take more than 3 months to do it. I've only hand washed it, and am super careful about the surfaces I set it on. I've had other brands that took a very long time before it started chipping, needless to say it was very disappointing. And to top it off, they don't cover cosmetic damage, which honestly they should either start thinking about covering it, or redoing the coating with some other material because I am sure I am not the first or the last to complain about it. Know that if you buy this product, you're paying for faulty coating, might as well ge...",0,0
88,0.058,0.764,0.178,0.8749,AshleyW,4,False,06/03/2023,My Travel Go-To! ◡̈,LOVE IT! Keeps ice for 24+ hours. My only complaint would be the paint chipping at the bottom of my cup. I am not rough with the cup at all; and take very good care of it.. yet the paint is still chipping. Other than that though; I'm obsessed with it and take it everywhere I go. ◡̈,0,0
89,0.0,0.95,0.05,0.3818,KMeff,2,False,02/11/2022,Soft Matte finish peels/cracks right away.,"I purchased with the early sale code. After using my tumbler for a little over a day the ""soft matte"" finish already started peeling on the bottom. I love the cup itself and the feel of the soft matte finish but this is not what I would expect. Especially with paying more for the finish.",0,0
90,0.076,0.731,0.193,0.8395,CaitlinG,4,False,30/01/2023,Beautiful but not durable,I was so excited to get this cup! It keeps ice fairly well and the cup is such a great color! It definitely helps me keep up with my water intake. I've only had it for a couple weeks now and unfortunately the matte coating is coming off. I'm not rough with it and it is chipping. I am very disappointed with the durability of the cup.,0,0
91,0.089,0.852,0.059,-0.1548,MariaS,3,False,03/02/2023,Soft Matte not great,"I really liked this tumbler, however I haven't even had it for a month and parts of the red material are falling off. It's not in area where it would hit or be against anything, I haven't dropped it or scraped it against anything. I'm disappointed in the quality considering the cost.",0,0
92,0.043,0.823,0.134,0.9378,StephanieF,1,False,21/12/2022,This peels easily!,"If I could give this less than a star I would. It started really well, and I loved how big it was and how much it held. Then I noticed peeling on the coating….ok no big. Maybe it got caught on something and had a slight scratch. It was about the size of a dot with a pen mark. Put it in the dishwasher and this happens! Not only is the soft matte silicone coating peeling…it had little scraps all over my dishwasher I had to clean out. I've submitted a warranty claim, but still no response. Even though I loved the soft matte texture better than the traditional coating (like a yeti or hydro flask feel)…it's not worth this headache and hassle! 

If you're going to buy one, I'd go with the traditional coating. They clearly did not test this out be...",0,0
93,0.029,0.892,0.079,0.5635,MarquitaB,4,False,01/04/2023,Matte finish chips,"Overall I am addicted to this tumbler! The soft matte is definitely an eye catcher and convo starter with other Stanley tumbler users. Only gave it 4 stars because with daily use and non abrasive cleaning, the bottom matte finish started to chip in less than a week. Once it starts it worsens rapidly. This doesn't affect the use of the tumbler but is definitely takes away from its appearance.",0,0
94,0.025,0.853,0.122,0.8209,Justme,5,False,05/02/2023,Absolutely perfect!!!!,"I have been a sucker for any pretty tumbler over the years so when my daughter-in-law got her first Stanley cup I knew I had to get one. The large size is great, fits in my cup holder perfectly, keeps my water cold all day, the handle is wonderful but the matte finish and the color is what makes it absolutely perfect!!!! I am now at the point where I am getting rid of all my other cups and starting a new collection of only Stanley cups!!!!",0,0
95,0.09,0.711,0.199,0.7717,MeganC,2,False,21/07/2023,Skip the Soft Matte,"Love the cup and the color, unfortunately the soft matte is peeling off the cup which is super disappointing and doesn't meet the typical Stanley quality or durability 

They won't process this under warranty because it's “cosmetic”. 

Buy the normal ones if you want long lasting satisfaction with your Stanley.",0,0
96,0.053,0.815,0.131,0.5719,LexieF,2,False,04/01/2023,Subpar,"I like the overall cup. My finish is cracked/chipping off and I also am unable to get the straw to line up with the logo, so it's always crooked. Definitely disappointing for the price of the cup. I wish I would've gotten the regular finish instead of the soft matte as the durability and quality is lacking.",0,0
97,0.0,0.768,0.232,0.8997,JazlynnB,4,False,15/03/2023,"Love it, just one caviaught","Love everything about this Tumbler, everyone is always complimenting the Matte feeling. With that being said, it does start to peel and scrape off over time. Still my go to cup, but hopefully the next version can stand the wear and tear of daily activity a little bit better.",0,0
98,0.0,0.866,0.134,0.8635,BridgetW,2,False,21/02/2023,Soft Touch Peels Off,"I WANTED to love it! After only one week, the soft touch coating began peeling off. I only hand washed it gently and don't put much wear and tear on my cups. I've never had issues with any cups before and only use it around the house and in the car. I really wish the coating didn't peel off so quickly. The cup keeps drinks cold and is a perfect size, but don't spend extra $ for a soft touch coating that peels off right away!",0,0
99,0.0,0.738,0.262,0.9707,StephanieP,5,False,01/03/2023,Love it!,"I absolutely love my Stanley cup. This is officially my second cup (I've bought more and given as gifts). Keeps my water cold and I love the handle and it fits perfect in the car. 
The texture of this H2.0 cup is almost velvety. I didn't realize that but definitely not mad at all! I thought matte was going to be “not shiny” but that's on me. I love the color too!",0,0
100,0.038,0.859,0.104,0.658,Ashleigh,5,False,04/12/2022,5 🌟,[This review was collected as part of a promotion.] This water bottle lived up to the hype! It's huge (a little cumbersome at first) and Kees water so cold and ice formed. The matte finish is gorgeous. Unlike any other water bottle I've owned in the past. My kids have been fighting over it. I've since purchased 4 more as Christmas gifts!,0,0
101,0.054,0.736,0.21,0.8419,LaceyG,4,False,31/05/2023,Beautiful but scratches quick,"Love love my Stanley, but the soft matte does scratch very quickly, which makes no sense because it's more expensive than the standard finish. If you are going to purchase, purchase the standard finish & not soft matte! It's beautiful, but scratches quick.",0,0
102,0.032,0.87,0.097,0.7666,Myfavoritecup,5,False,13/12/2022,I love this cup!!,"[This review was collected as part of a promotion.] I love everything about this cup. I recieved it as part of the Stellar Testing Panel and i couldn't be happier. This cup can keep ice in it, with the minimal amount of melting for more then 24 hours.. it fits in every cup holder. It has a handle and it has a lid that has an option for a straw or to sip directly from the cup. It's the best cup I use it every day.",0,0
103,0.062,0.69,0.249,0.9504,Anonymous,2,False,14/02/2023,Beware!!,"I love all my Stanley's- but beware this one's sore matte chips off. I've had my for three weeks and the whole bottoms hands already peeled away. And is starting to crack up the side. I absolutely LOVE the sage, prettier in person. 
I leave it on my work desk- not throwing it around and have hand washed it once.",0,0
104,0.039,0.762,0.199,0.9511,Stephanie,5,False,03/03/2023,Buttery soft,"Have always enjoyed Stanley products even as a little girl. I was so excited when I seen the matte shale color! As you can see by the photo with my blanket it's a color I really enjoy that you just don't see a enough of. I absolutely love how it feels, it's buttery soft and feels like a soft rubber coating. It doesn't seem like it would scratch to easily but we shall see. The secondary lid and handle color is more olive green then the blue in the photo online so was a little sadden by that but I still very much love the color combo. I hope they do more with the matte line",0,0
105,0.074,0.829,0.097,0.5515,Sheridan,3,False,15/02/2023,Expected more for the price,"The packaging overall could've been more protective. The soft matte coating isn't durable whatsoever, just opened it today and there is already a speck of paint missing. But the biggest issues are the handle and lid colors don't quite match the tumbler, and my lid where the straw is, isn't lined up with the stanley logo. It is going to drive me crazy to look at since it is not centered with each other. I honestly expected more for basically 60 bucks. I should've went with my gut and bought from simple modern like i always do... better quality for half the price... very dissatisfied.",0,0
106,0.0,0.825,0.175,0.9216,MariaM,2,False,22/03/2023,Soft Matte chips and peels,"I have been using the Soft Matte 40oz in Dune for less than 2 weeks and the finish is peeling and chipping away. I am very easy on it, only bringing it from my car to my desk. I love the color. I reached out to customer service and I hope the can make it right. My daughter (13yr) has had the 40OZ tumbler without the soft matte finish for 2 months and the finish still looks like new.",0,0
107,0.023,0.733,0.244,0.9883,Mel,5,False,03/12/2022,Love that it's dishwasher safe!,"[This review was collected as part of a promotion.] I am a person who always needs my emotional security water bottle so I was excited that they make them in 40 oz (I'll never run out of water!) that will still fit in my cup holder. I will say it is quite large but you get used to it quickly. The soft touch matte feel is really a nice feature. Some matte things show a lot of finger prints and can look dirty but this one doesn't! I worry about it maybe getting scratched easily but after a month of use so far it hasn't other than wear and tear on the very bottom. Other features I love: my water stays cold all day, it has a nice wide straw, and my number one favorite thing is that it's dishwasher safe! Thanks to Stellar Product Testing Panel f...",0,0
108,0.084,0.916,0.0,-0.7574,Rebecca,3,False,21/04/2023,Paint wearing already?,"I'm extremely disappointed by the quality of the product I received, especially after all of the hype I've seen around it. I've had my 40oz tumbler for a week, and the paint is already wearing down more than any other cup I've owned for way longer. I've only used it around my house and in my car. I don't understand how the paint can wear so quickly for such an expensive product. Disappointed is an understatement.",0,0
109,0.134,0.834,0.032,-0.7878,CraigN,3,False,02/02/2023,Good but scratches easily,"Overall really like it but, sadly, it got scratched and dinged after the first wash and use. One scratch on the side and the bottom edges are all down to metal. I don't wash it in the dishwasher anymore, which was one of the selling points to me. Sad for how much I paid.",0,0
110,0.036,0.812,0.152,0.9422,Gavin,5,False,03/12/2022,My New Favorite Work Cup,"[This review was collected as part of a promotion.] Thanks to the Stellar Product Testing Panel for providing me with this water bottle. 

The Stanley cup is phenomenal! Beverages stay warm/cold for hours. I typically drink out of double wall stainless steel tumblers and this one has become my favorite. Consistently refreshing with every sip. 

The soft touch of the outer walls make a comfortable grip even if you choose not to use the handle. But beware of minor scratches. 

I usually drink without a straw and I feel like the lip of it is a little deep and made it kind of awkward at first to get used to. 

It's easy to clean and even though it's dish washer safe I wouldn't recommend cleaning the cup that way.",0,0
111,0.071,0.865,0.064,-0.1261,erinb,2,False,07/02/2023,Matte finish is NOT durable and WILL chip,"Within one week of purchase, the matte coating on the cup has begun to chip away. It also holds tight to any debris it comes in contact with- pet hair, dirt, yarn fuzz, you name it. 
If I hadn't been so blindly excited to finally get in on the trend, I would've been more careful and avoided this specific model.
If you buy the matte finish, baby it.",0,0
112,0.019,0.754,0.227,0.9757,Laura,5,False,04/12/2022,Amazing travel tumbler!,"[This review was collected as part of a promotion.] If you're like me and constantly have a tumbler or mug in your hand, this is the one to have! I've gotten so many compliments on this tumbler, it holds so much water and keeps it cold for hours. 
My kids love it as well, it's not heavy and easy to hold. 
The handle is nice and big, my husband even likes how it feels. It's definitely my goto tumbler when I'm out and about. 

We had this tumbler during an outdoor Nativity event with the kids and got so many compliments by the actors. I highly recommended this tumbler",0,0
113,0.041,0.61,0.349,0.9593,JordynP,4,False,30/06/2023,Soft Matte Stanley 40oz,"I really love this water bottle! It's super easy to carry around, to remember, and the straw honestly helps me to drink it, lol! 
However, the soft matte finish is not dishwasher safe. The bottom of my Stanley has chipped almost completely. So beware!",0,0
114,0.112,0.809,0.079,-0.296,GrierH,1,False,31/12/2022,Useless,"This thing is about as “leak resistant” as putting cling wrap over a cup. Stupid expensive for what it is. I truly have no idea who this is for, you can't put it in your bag and take it with you without it spilling and ruining all of your belongings. Are there any other lids that fit this thing that actually work?",0,0
115,0.0,0.839,0.161,0.9379,Anonymous,5,False,16/05/2023,Amazing quality!!,This Tumbler is a most!! I have many other Stanley quenchers today I received the Dune soft matte and I'm in love with how beautiful this color is and so soft to the touch. My ice water stays cold all day I vene left one of my cups in the car for two days went to get it and the water after being in the sun was cold. Love them !! I will I'll come back for more.,0,0
116,0.014,0.832,0.154,0.9335,Anita,5,False,11/11/2022,Matte finish h2.0 is the best water tumbler in the world,"I'm in LOVE with my new Stanley tumbler. I have a cabinet overflowing with other swell, hydro flask, yeti, plastic cups, and glass bottles with silicon wraps. The Stanley is by far so much super bottles because the Stanley cares 40 oz of water. I reach my daily gallon water cool with just over 2 refills. The handle and straw are the major game changers compared to other bottles. It makes it really easy to carry and drink from the bottle. Other features that I love the H2.0 designs to make the bottle more leak proof and the matte finish that makes it more comfortable to carry and resists scratches. I never knew I could feel so passionate about a water bottle, but here we are.",0,0
117,0.105,0.749,0.146,0.5161,CynthiaS,1,False,18/07/2023,they do not honor normal wear and product fails to stand up to any paint issues,Loved it for a month or two … at first just scratches and now all the paint is coming off and don't worry about that warranty because it's a lifetime warranty on something you are embarrasses to carry…. So sad so a cool look and works well.  However not standing by normal wear and tear has lost me. i thought at the price that i could expect quality. Back to my old Yeti 😢,0,0
118,0.013,0.817,0.17,0.9726,Lauren,5,False,06/12/2022,Perfect for daily use!,"[This review was collected as part of a promotion.] Thanks to the Stellar Product Testing Panel for providing me with this water bottle.  I received this cup just days after giving birth to my son. As a breastfeeding mom to a newborn, it is absolutely perfect. The handle makes it easy to carry around at home and take on the go. The smooth, soft matte finish feels so luxurious! The lid screws on, which I love so it doesn't come off accidentally when reaching for it while feeding my baby in the middle of the night and it came with a straw as well which I prefer. I have used this cup every day and all through the night and and it keeps my water cold the entire night!! My favorite thing is the large capacity of this cup (while fitting in a cup ...",0,0
119,0.158,0.732,0.11,-0.6161,KelseyM,2,False,21/02/2023,Disappointed,Love the color and how much this tumbler can hold but overall really disappointing at how the durability is after only having it one month and only hand washing it a few times. It is chipping in multiple places and leaks really bad. Overall will not be buying Stanley products again.,0,0
120,0.0,0.838,0.162,0.8268,SofiaB,3,False,19/04/2023,BUYER BEWARE: matte finish peels off quickly,"Love the color and feel of this tumbler, however as many others have stated the matte finish comes off very quickly.  I guess you have to be very careful with this tumbler to ensure it doesn't peel, which is not likely for me since I use mine all day everyday.",0,0
121,0.0,0.791,0.209,0.9325,LauraH,5,False,16/03/2023,You Need this Cup!,"Just had surgery and had to drink a lot of water, this cup keeps your drink cold for days! Be prepared it is a little heavier and it is a big cup. But it fits in cup holders which is perfect. I have several cups and they all claim to keep drinks cold but this truly does and worth the money!",0,0
122,0.044,0.956,0.0,-0.645,StanleyFan33,1,False,13/11/2022,Coating peeling after 8 days.,"I've had my Quencher H2.0 FlowState™ Tumbler (Soft Matte) for exactly 8 days. I've only been using it for the last 3. This morning, I felt something flaky in the back of it while I was drinking from it. It turned out to be the matte coating crumbling off! The initial spot is continuing to spread and more is coming off continuously. I have only used it at home and have only hand-washed it. I could not imagine it holding up in the dishwasher! Incredibly disappointed, and can't believe I paid an extra $10 for this “special” finish. Buyer beware!",0,0
123,0.027,0.875,0.098,0.7649,ElizabethL,4,False,20/02/2023,Love my cup,I got my cup for Christmas and I love it! There's only 2 reasons why it's not 5 stars and it's because the cup is not leak proof and it's not because of the straw I accidentally tipped over my cup in my car and it spilled and I've had my cup at my office 90% of the time and there are already parts of the cup coming off like the “skin”of the cup. Overall love the cup just be very careful not to rub it against it anywhere idk what I did to mine but there are scratches from where the matte skin is coming off!,0,0
124,0.058,0.708,0.234,0.866,LauraD,3,False,23/12/2022,Great cup but chips,"Love this cup for its ability to fit into my car cup holder, and it does keep my water nice and cold all day and even overnight. Giving it 3 stars bc the matte material is already chipping after 2 weeks of use. For a cup this expensive it is extremely disappointing.",0,0
125,0.088,0.882,0.03,-0.5522,AngelaS,3,False,25/05/2023,Soft matte wears down on the bottom,"The tumblers are nice but the one complaint I have is the soft matte, which were more expensive, rubs off on the bottom. I haven't even had mine a year and have never dropped it but noticed on the bottom the matte finish wears off and you can see the silver cup underneath.  For the price I can't recommend the soft matte.",0,0
126,0.052,0.87,0.078,0.34,LynetteB,2,False,13/11/2022,Silicone is already chipping,"Love the look and feel of the new soft matte tumbler, however after using it for a little over a week (sitting on my desk at work and in my cup holder in the car), the silicone coating is beginning to chip and peel. Sadly, I don't think it will hold up.",0,0
127,0.044,0.852,0.104,0.8396,NoelleR,5,False,04/12/2022,This water bottle has it all!,"[This review was collected as part of a promotion.] When this water bottle first arrived, I didn't think I would like it because of how big it is. I was so wrong! It has quickly become my favorite water bottle. I love that I only have to fill it once in the morning and once in the evening, and it has plenty of water to last me throughout my day. When I do refill it, it always has ice left, which sometimes is 12 hours later! Some of my favorite features about this bottle is that it has a handle for easy carrying, and it fits in my cup holders in my car. I didn't know how much I would end up loving the handle. I didn't think it was really necessary, but it has made carrying it so much easier. I really like the soft-touch matte finish, it make...",0,0
128,0.163,0.761,0.077,-0.6847,LadonnaB,1,False,14/01/2023,Damage cup upon arrival,I am so upset. My Stanley cup came chipped and several damaged spots on the box. I was so excited for this to come today and so disappointed. This cup is so beautiful but any scratch and you're screwed. The matte color will eventually continue to rip. So much money for this to happen. I am returning this cup.,0,0
129,0.158,0.779,0.063,-0.8684,MACEYS,1,False,02/03/2023,So unimpressed!,So upset with service and product. First of all it took 23 days to receive my order. I thought my package had been lost so I reached out to customer service and didn't get a response until 10 days later. Turns out it was lost and I truly believe that they would have never known it was lost if I didn't reach out. Now I've had it for only a little over a month and the matte finish is already coming off in multiple spots and I can see the metal. So disappointed in the quality of this cup. I have never even dropped this tumbler so not sure how it could so easily be damaged already.,0,0
