id,vader_neg,vader_neu,vader_pos,vader_compound,name,rating,verified,date,title,body,like,dislike
1,0.052,0.772,0.176,0.8164,Kevin,5,True,26/06/2024,Love,I bought this for my fiancé as a surprise because she always complained that her previous cup never held ice or kept her water cold. She loves the Stanley! It keeps her ice frozen for 12  hours and she doesn't leave home without it. We honestly didn't understand the “Stanley” rave but now here I am getting myself one too. Would definitely recommend.,0,0
2,0.0,0.684,0.316,0.5719,Jasmine,5,True,09/07/2024,Stanley 40oz in Shale,LOVEEEE THIS CUP ARRIVED SO FAST AND ITS PERFECT,0,0
3,0.109,0.801,0.09,-0.3227,HannahC,3,False,26/11/2023,Disappointed,"Work from home, so this is a pampered cup. Unfortunately I can't give it 5 stars.

The 3 stars because it's a Stanley and I love the color and size. 

Minus 1 star for the terrible smudging and water drip marks that make it look dirty even starting off in the morning... embarrassing if at a conference. 

Minus a 2nd star for the finish coming off the bottom. As you can see, it's barely (and gently) used -- the sticker is still intact. 

I loved my other Stanley and am kicking myself for giving it away and spending so much on this style. I'm not sure who tested it before production, but it seems like someone didn't think everything through. 

Very disappointing.",0,0
4,0.047,0.915,0.038,-0.1396,ValC,1,True,06/02/2024,Fake Stanley,"This is not a real Stanley. The straw is not a Stanley straw and the lid does not line up. Compared to the other Stanley's I have and it isn't close. What's worse is that I live in the Virgin Islands and cannot schedule a return or get a refund. I was ripped off. Do not buy. In pictures, fake Stanley is on the left. Real Stanley on the right.",0,0
5,0.072,0.863,0.065,-0.2206,JasonP,1,False,29/12/2023,New but Chipping Already,"I recently purchased the 40oz Soft Matte in Orchid for my wife. I have a few other Stanley products and was looking forward to this. Unfortunately, the bottom started to chip away revealing the stainless underneath. This was only after 4 uses between the house and her office. It was never dropped or abused. I contacted Stanley and they consider it ""normal wear and tear."" I would agree if it was a year old and not less than a month old and only used 4 times. It could be possible that Stanley's quality assurance has gone down, or that they don't care about quality  long lasting products anymore. We are disappointed in this Soft Matte Quencher.",0,0
6,0.085,0.894,0.022,-0.7652,ElizabethH,1,False,03/01/2024,Finish has chipped and looks greasy.,"I am really disappointed with this cup. I have several of the regular finish Stanley cups and LOVE them. This one I haven't used in MONTHS, despite loving the color and the initial texture. However, after a few uses, I noticed that the finish had a sizeable chip in it. I was upset that my new cup was already damaged, but assumed it was my fault because it was my first Stanley (I had purchased one previously as a gift.) 
Then I noticed that the finish looked greasy, even after just being washed. I tried several cleaners, from regular Dawn dish soap to the Powerwash and I can't seem to get the ""stains"" off the finish now either.
I now own several of the ""regular"" finish cups and haven't had ANY of these issues with them, so I am assuming it's...",0,0
7,0.081,0.85,0.069,0.1486,ThomasB,1,False,27/03/2024,Cup lasted about a year before self destructing,"Don't expect this cup to last more than a year. I purchased in January 2023. For what it costs I'd expect better construction and quality. I have never dropped mine. The silicon/plastic cupholders on my truck wore away the paint and the handle broke off while I was screwing it shut yesterday.  Save your money!

 It's not like I work on a job site either, I work from home and the only place this cup has really been is around the house and in the car cupholders.",0,0
8,0.164,0.769,0.067,-0.9177,JamesB,1,False,17/01/2024,Do NOT buy Matte Mug,"As a longtime fan of Stanley's quality and durability, I recently purchased a Matte Red mug with high expectations. Unfortunately, my experience has been incredibly disappointing. The outer matte coating, unlike the classic Stanley finish on my other mugs, feels more like a fragile glove glued on. To my dismay, it has started peeling badly despite hand-washing and careful handling. This level of wear and tear feels unacceptable for a Stanley product, especially compared to my other mugs that have held up flawlessly for years.

What adds to my frustration is Stanley's customer service response, attributing this issue to ""normal wear and tear."" I strongly disagree. In my opinion, this peeling isn't normal wear and tear; it's a flaw in the mat...",0,0
9,0.072,0.829,0.099,0.4149,Lanna,1,True,11/07/2024,very unique color,"the quality of the lid was not up to what other brands have so I was concerned issues would happen later but my husband has only been using his for 2wks!! the silicone piece on top that seals the sraw down in center pulled out and immediately shrank up and looks like a teething toddler got ahold of it chewed on it! I bought one same order doesn't keep ice longer 12hrs? different colors, yes! so can't be same batch or lot. NOT WORTH THE PRICE over the other cups was highly disappointed",0,0
10,0.04,0.907,0.053,0.2557,SurpriseOma,1,True,10/07/2024,Not worth $-company won't stand behind mfg defects,"I bought two of these. One for myself and one for my husband. It has helped to increase our daily water intake. And the most important reason I got it is that the mugs do fit in my cup holders in my car. However, the claims for how long it will keep things cold or frozen are ridiculous. Ice won't even stay in the cup for longer than a few hours. If you want something to stay cold longer, a Yeti brand does a better job. 

The one thing that really irked me was the lid on my cup. The lid has the threads on incorrectly so that when you screw it on, the straw ends up almost at the 9:00 position. If you aren't careful when you pickup the mug - you can put an eye out. I know some people have problems getting the lid on, but that's not what is hap...",0,0
11,0.141,0.731,0.128,-0.1432,Gunpowder,2,False,05/04/2024,Paint/Coating Chips,Cup works great but I'm a little upset that I paid as much money as I did and the coating is coming off. It looks like crap. I would not have spent that much money if I had known this would happen.,0,0
12,0.177,0.712,0.111,-0.3182,SierraB,1,False,10/04/2024,Disappointed,I have only had it a few a weeks and it's peeling I'm super sad because this is the first Stanley I've ever bought. So I'm sad it's peeling after 2 weeks…,0,0
13,0.071,0.871,0.059,-0.1513,Jenny,1,True,11/05/2024,"Cheap, broken straw included","This arrived and when I opened it to put in a gift bag for my mom, I noticed the straw was a skinny, cheap plastic straw (non-Stanley) that was bent in the middle with a hole. I had to run out and buy a box of Stanley straws for $14. Very disappointing",0,0
14,0.097,0.723,0.179,0.3818,BrandiC,1,False,03/06/2024,Not worth it,"Loved this cup but it chips like crazy. I won't buy another one again, especially for the money you spend just for it to chip right off.",0,0
15,0.0,0.692,0.308,0.9443,ewynne616,4,False,22/12/2023,LOVE THIS!! do recommend,I absolutely love my cup! But I do notice it kind of leaks when you tilt it to the side a little bit not much of a problem for me still an absolutely amazing products and i will definitely be buying again soon.,0,0
16,0.033,0.648,0.318,0.9395,GracielaG,5,False,10/12/2023,Stanley cup..?,"At first I was like no, I have starbucks cups already but after the video, I was convinced, i gave it a shot purchase it and I'm really staying hydrated for sure!!! I'm in love!! Part of the Stanley community now 🙌",0,0
17,0.0,0.615,0.385,0.9153,AmandaE,5,False,29/11/2023,Best cup ever,I love the matte blue color and that it holds ice for days. I was not expecting the rubber like texture but definitely an added bonus to prevent scratching.,0,0
18,0.087,0.847,0.066,-0.2494,JustinT,1,False,23/08/2023,Disappointed in the durability,"I have owned this item for 1-2 months. I decided to purchase this after I had used a target knock off. I have to say I am not impressed. The finish immediately started chipping off. It is so fragile, forget even placing this mug on a concrete surface without exterior damage. The coating is peeling off in multiple locations. Furthermore, I do not find this mug to have superior insulation properties in comparison to ""knock off brands"". I'm really disappointed in the durability aspect. However, I find the handle and straw a convenient design.",0,0
19,0.119,0.853,0.028,-0.7684,KristenC,2,False,26/08/2023,Opt out of the matte,"I like the bottle itself, but regret the one I chose. Within three months the matte covering was peeling off to reveal the stainless steel underneath from simply putting it in my car cupholder. I regret paying more for this matte option vs. going for the cheaper option that doesn't have a covering that can peel off with normal use.",0,0
20,0.064,0.762,0.174,0.8011,ZoeN,3,False,26/10/2023,Don't The Soft Matte!!!,I loved this product until the paint started chipping after having it for one month. I still really like the product just wouldn't recommend getting the soft matte one. My friends that have the regular non-matte ones don't have this issue which is ironic since the soft matte costs more...,0,0
21,0.105,0.835,0.06,-0.4935,RichH,3,False,23/09/2023,"Great Tumbler, Bad Matte","About 3 months ago i purchased a 40-ounce tumbler with a matte finish. For keeping drinks cool, it is without peers. Really awesome! However, unlike my wife's 40-ounce Stanley with the regular finish, the matte finish is very susceptible to scratches and nicks. Also, the matte tumbler leaves black, rings on our countertops that are hard to buff out. I love the tumbler, but regret the ""upgraded"" matte finish",0,0
22,0.084,0.759,0.157,0.679,SheilaC,4,False,17/09/2023,Great cup!,I love this cup. I drink so much more water now because of the straw. I do not like how it leaks if it tips over though. Like pours out fast. The cup has scratched at the bottom from cupholders use. That's disappointing. Other than that it's a good product! Keeps my drinks cold for 24 hours.,0,0
23,0.124,0.876,0.0,-0.7937,LynneP,2,False,24/07/2023,Coating peeling,"I'm disappointed in the coating on this tumbler. After less than 6 months of use, the coating has started to peel off the bottom of the tumbler. I'd stick with the traditional version and skip this one.  Lifetime warranty does not cover cosmetic flaws, unfortunately. While I'd give the tumbler five stars for function, overall, I'm not impressed with this version. .",0,0
24,0.127,0.704,0.169,0.3682,JamieR,3,False,02/10/2023,Chip paint,Bought the red rust as a valentines present to myself and the paint is chipping off. It hand washed and only goes to work and gym with me and no matter how careful I am the paint is chipping . Love the cup itself hate the paint. Not worth the extra money,0,0
25,0.042,0.844,0.114,0.4118,CatieL,2,False,05/10/2023,40oz matte review.,"The matte coating chips very easily, i've never dropped this cup. The ice doesn't last 11 hours like it claims. I put ice in my cup around 7 am and by noon it's all melted. Very disappointed with the quality but i still use it everyday to get my money's worth.",0,0
26,0.043,0.845,0.112,0.6512,HollyH,2,False,27/08/2023,Soft matte finish is trash,"The soft matte finish lacks durability.  My daughter received a Stanley as a birthday gift and was so excited, only to be greatly disappointed when the soft matte finish began to knick/peel off.  I have also noticed that the finish is wearing thin where the tumbler widens from the narrowed cup holder area.  She has only ever hand-washed her tumbler.  Wish Stanely had her color ""Stormy Sea"" in the standard (more durable) finish.",0,0
27,0.015,0.851,0.134,0.8825,VeronicaS,4,False,06/09/2023,Soft Matte Scratches :(,I can only speak for the “soft matte” tumblers. I purchased the dune colored one in January for myself. I LOVE this dang cup. It goes everywhere with me. It keeps my water ice cold even over night. When I purchased I could tell the material would scratch so I've been so careful with it. It was not a cheap purchase and I wanted to keep it as nice looking for as long as possible. Last night I accidentally knocked it over and it fell on my nightstand (not even the floor!) and there's a huge scratch. I definitely won't get another soft matte variety. Maybe I'm being silly but I'm bummed lol,0,0
28,0.03,0.783,0.186,0.9143,JASONA,3,False,24/07/2023,I really want to love this…,"This cup gets 3 reviews because when you get it, it is amazing!  The color and the feel. You WILL get compliments!
The tumbler integrity will probably hold like my other non matte tumblers but as many many people will attest, the paint will not stay on… mine lasted about 3 weeks before my first paint chip. I cannot recommend anybody buying the soft matte Stanley's until they improve the design for the paint to not cheap so easily.",0,0
29,0.115,0.739,0.146,0.4314,TerynH,1,False,01/08/2023,Don't get the matte Stanley!,"I was so excited about the matte tumbler when I bought it.  However, after a couple months of careful use, the matte coating has chipped off and the tumbler looks terrible.  The bottom where you set it down EASILY chips off.  Turns out it definitely IS NOT worth the extra money for the matte version, stick with the regular Stanley!  Bummer lessoned learned on my part....  And cosmetic damage isn't covered by warranty, so you are just out of luck.",0,0
30,0.089,0.797,0.114,0.0962,AshleyP,1,False,15/08/2023,Don't get the matte tumbler,"I don't know how this has good reviews, unless people are just reviewing as soon as they receive it and then never updating. The matte coating peels off after just a few weeks. Super bad quality, looks very cheap. I like Stanley cups in general, but would never recommend the matte edition.",0,0
31,0.108,0.84,0.052,-0.6798,elizabethd,1,False,26/08/2023,Material sucks,Peeling bad after 3 months of having it. Tried reaching out to customer support to get a new one but they said it was out of stock even though it isn't out of stock if I try to go purchase it on the website. Very disappointed since this cup is not cheap and I've only have it for 3 months now,0,0
32,0.031,0.756,0.213,0.977,AmandaM,1,False,12/10/2023,Soft Matte falls Flat,"I bought this cup in August '23 for my boyfriend, less than 2 weeks of use I submitted a warranty claim because of the peeling coat. Its a gorgeous color and I wish I had read the reviews, but its cute for a couple days. I submitted a claim and honestly, if I had the box I would've just returned it bc they made it seem like this wasn't their fault but eventually they said they could make it up to me by giving me a replacement 32 oz cup... i bought the 40oz.... no thanks. Now 2 months later the coating is atrocious looking with huge peel marks. This has never been washed and it doesn't leave the house so how is this happening??? Idk how this is still even on their site.",0,0
33,0.114,0.834,0.053,-0.8573,HannahP,2,False,20/08/2023,Disappointed,"I am disappointed with my Stanley quencher. When I first got it, the bottom of the cup immediately got scratch marks. Since it was on the bottom of the cup it was understandable as it touches a lot of surfaces and it was on the bottom so I didn't see it much. But then the scratches have shown up all over the cup. The matte finish has completely torn off in those areas and I am very disappointed. I am very careful with my Stanley cup and it is just disappointing that such an expensive cup doesn't hold up for even a few months. With all that said, I do love how much water it holds and how it keeps it cold for a long period of time. I am just disappointed that the look of it has not held up the way I thought it would.",0,0
34,0.053,0.908,0.039,-0.1692,AlaynaF,1,False,26/07/2023,Chipping,Cute cup but after a month it started chipping. I never put it in the dishwasher or dropped it. A lot of people are having this issue. I submitted a claim and they did nothing for me.I have 3 other Stanley's and none of them have this issue. I do not recommend the matte  cup.,0,0
35,0.033,0.718,0.25,0.936,JoannaG,3,False,23/10/2023,Stanley tumbler,Great water bottle but not worth the price. There are so many Stanley replicas that are sooo much cheaper and will keep your water cool for longer. It's cute and I love how portable it is but I've only had it for 2-3 months and the paint is wearing off,0,0
36,0.079,0.799,0.122,0.3071,JulieY,3,False,08/10/2023,Holes in Outer Material,"Great cup, but I was disappointed in how quickly the outer material started to get holes. I had only been using my cup for a couple of weeks, and I saw multiple holes in the soft outer material start to form. Given the price, I would have expected better quality.",0,0
37,0.153,0.757,0.09,-0.6994,MelissaM,1,False,27/07/2023,GARBAGE that Stanley doesn't even stand behind,I waited for months to spend the money on yet another tumbler. I'm a yeti fan and all the hype about this new cup confused me. I finally saw enough influencers in LOVE with this cup that I decided to try it out and I am SO DISAPPOINTED. It's already falling apart in ways my yeti never would. The soft matte just peels off after months of normal water drinking. It looks like a mess and Stanley's warranty “doesn't cover cosmetic defects” so there is no replacing it. What a waste of money. I'm going back to yeti.,0,0
38,0.083,0.865,0.052,-0.6128,Anonymous,2,False,01/08/2023,Chips and Peels,"I really liked this product when i first received it, but within the first few weeks I already noticed some chipping in the soft material. Everyday use has continued to chip and rub off the material on the bottom. I have had this cup now for 3 months and the material is starting to peel up the side from the bottom. I asked for a warranty and they told me it does not cover it. So I'm wondering what the warranty is for. It's cool that its soft to touch but poor design :(",0,0
39,0.0,0.774,0.226,0.9785,amber,4,False,09/09/2023,"great quality, but just some concerns!","i love this tumbler so much but there is just one thing. When i git mine in the mail, i was super exited. But when i took it out of its packaging, i noticed it had a rubber like thing on it. And i have the color shale btw. You would have to be super careful with this, because ive had mine for a month or two now, and the rubber is already staring to peel from the bottom. All together though, if you were to buy this, make sure you get a boot for it. But other than that, i would totally recommend!",0,0
40,0.072,0.928,0.0,-0.2144,Betty,1,True,02/06/2024,Damaged and missing straw!,"i disliked the fact that it was a returned item, and the person that evidently returned it---kept the straw, but yet it has a verified and a return lable...",0,0
41,0.0,0.81,0.19,0.6115,Wallace,5,True,22/06/2024,Very satisfied!,I was very happy with this purchase. My cup arrived sooner than expected. Planning to order another color soon.,0,0
42,0.22,0.78,0.0,-0.7346,Alyssa,3,False,21/12/2023,Disappointing,I just bought this cup and only used it 4 times and the handle just broke off. I'm very disappointed on how long this cup lasted,0,0
43,0.0,0.576,0.424,0.9325,RynataT,5,False,01/01/2024,Love it,Love my new cup. Everything stays cold. I love the color and the feel of the cup it's easy to keep clean and maintain.,0,0
44,0.071,0.74,0.189,0.5451,Erica,1,False,27/11/2023,Peeling,I honestly cannot recommend a soft mad. It was peeling within two weeks and the warranty does not cover any cosmetic or we tear every day even,0,0
45,0.152,0.624,0.223,0.2322,KaileyB,3,False,02/01/2024,Chipped,"This Stanley is nice but my chipped this morning, they chip so easily I heard but I got it anyways. I'm disappointed",0,0
46,0.204,0.69,0.106,-0.7383,JulieP,2,False,13/09/2023,Matte Finish Chips & Peels:(,Love the cup & keeps the water ice cold but the soft touch finish is awful. It chips and peels easily from cup holders and anything it touches- not even getting dropped. Very unhappy with how old and worn it looks so quickly.,0,0
47,0.0,0.852,0.148,0.7054,JeanR,1,False,03/08/2023,Paint Chipping,I can't believe it I have only had it for 5 months at the most and the paint is chipping off. Biggest rip off. So un happy!! Will never buy a Stanley again!,0,0
48,0.038,0.737,0.225,0.7463,CarlieN,4,False,14/08/2023,Great and Cute!,"I love my Quencher! 
It keeps my water cold for so long and after many refills too. 
Only downside was it chips easily on the bottom. But that's easily fixed and prevented with a protective sleeve.",0,0
49,0.148,0.852,0.0,-0.7079,Keira,1,False,25/10/2023,Do Not Buy Soft Matte,I've had this for about six months and not only is it very expensive but the covering started to peel! Do not buy the soft matte Stanley. Very disappointed.,0,0
50,0.0,0.674,0.326,0.9322,ErinR,1,False,28/07/2023,Peeling and not used much,"I did love this water bottle, but after 5 months it is starting to peel just like the other reviewers had said. I thought I would take a chance since the reviews are still good. Don't be fooled it will peel.",0,0
51,0.0,0.922,0.078,0.4005,KellieC,3,False,29/07/2023,Matte tears easily on its own,I was so excited to get the soft matte. After using it for 3 days the soft matte already has holes in it and continues to get more.  I would stick with the normal painted Stanley's.,0,0
52,0.078,0.85,0.072,-0.0754,AllisonN,1,False,30/08/2023,Disappointed,"The coating has started to peel off of my cup and I haven't even had 6months. It has only ever been hand washed and I haven't dropped. 
For the price of these cups it's really disappointing for it to already be peeling",0,0
53,0.093,0.774,0.132,0.1027,holly,2,False,09/10/2023,cute but chips,"the soft matte coating flakes/chips easily. i really wanted a certain color so i bought the soft matte as that was the only
style it was available in. for being $10 more, i'm disappointed",0,0
54,0.148,0.633,0.219,0.5716,AnnaK,2,False,25/08/2023,Would not buy this type again,Love the size great for someone who drinks water all the time... the outside started peeling off within 2 weeks not impressive with how expensive this brand is. :(,0,0
55,0.12,0.601,0.279,0.7839,JackieP,3,False,05/10/2023,Love and hate the soft matte finish,"Keeps things cold, love the color, love the handle, love the size. I'm obsessed with the soft matte finish but it is damaged incredibly easy. I wouldn't buy the soft matte finish again",0,0
56,0.128,0.674,0.198,0.1531,SamanthaA,2,False,10/08/2023,Don't buy soft matte,I wish I could have given this cup a Better rating but the peeling is excessive. I wish I would have known before that the soft matte was going to be such a horrible product,0,0
57,0.054,0.874,0.072,0.2023,ValerieS,2,False,03/09/2023,Don't buy,"The peeling on this cup is crazy, just from putting it in my cup holder my cup has peeled all around and the bottom of it is pretty much all peeled I can only assume that's from just standing the cup up",0,0
58,0.096,0.833,0.071,-0.2023,NATALIEH,1,False,20/09/2023,Matte Coating is Peeling,The bottom portion is peeling away despite only going in and out of a car cupholder maybe 5 times. Disappointed as I'm sure this peeling will only continue until its bare.,0,0
59,0.0,1.0,0.0,0.0,ZacharyB,1,False,22/09/2023,Not satisfied,Matte coating started peeling within 4 months. We only handwash but I guess traveling in a vehicle is too much for it. Warranty only covers thermal issues.,0,0
60,0.0,0.836,0.164,0.7078,cayleep,1,False,06/08/2023,handle fell off,the handle fell off today so this email to review my stanley couldn't have came at a more perfect time. the matte coating has also started peeling off excessively and just doesn't stop.,0,0
61,0.059,0.73,0.211,0.7719,LaQuitaT,1,False,08/08/2023,Disappointed actually,I'm not happy because the bottom of the cup and sides are already starting to rust I don't put this in dishwasher I was it by hand and it's like this I'm like all this money I paid for my cup to look like that,0,0
62,0.074,0.802,0.125,0.509,Eddie,2,False,08/11/2023,"Not recommended, handle came apart","The Handle came apart, and separated from the cup after less than a year.   Can not put handle back on.  Would not recommend, unless they replace it after I created a warranty claim.  If they replace, i'll come back to leave a positive review.",0,0
63,0.166,0.786,0.048,-0.7895,CassidyB,1,False,22/07/2023,Matte finish chipping after 2 weeks,"I loved this cup but after less than two weeks of use the finish is coming off! I didn't read the reviews before but should have, this seems to be a common problem. Really disappointed to have paid extra and now have the finish coming off.",0,0
64,0.091,0.796,0.113,0.2489,AmyC,1,False,16/11/2023,Ugh- Disappointment!,"Very disappointed. The matte coating is chipping off the bottom of the cup, and is starting to make its way upward. I'm super sad because the color is gorgeous, but eventually, I'll have a naked Stanley. DO NOT buy the matte-finished cups!",0,0
65,0.0,0.599,0.401,0.9658,MG,5,True,11/01/2024,Happy girl loves Stanley,My granddaughter loves her Stanley Tumblr. She loves the color. She loves the size. She loves the  quality. Partially I think it's a status symbol and the  reaction at school and sports has been so positive.,0,0
66,0.116,0.825,0.059,-0.4215,bryan,2,True,04/01/2024,The wrong straw has me feeling sketchy,"The cup was the right color and it has Stanley branding, but the straw was the wrong straw, which has me questioning the legitimacy of the cup I purchased. If you are going to upcharge $30, at least make sure you include the correct straw.",0,0
