id,vader_neg,vader_neu,vader_pos,vader_compound,name,rating,verified,date,title,body,like,dislike
224,0.014,0.883,0.103,0.9228,MyGoToTumbler,5,False,04/12/2022,My Go-To Tumbler,"[This review was collected as part of a promotion.] I am a mom of two and always on the go. From school drop offs, to running my own small business, and trying to keep up with exercise, I need a tumbler that can fit all my needs and activities. This 40oz soft touch quencher tumbler is just that and more. Water is my drink of choice and I ALWAYS have some with me. This tumbler checks several of my boxes when looking for a cup/tumbler. It keeps my iced drinks cold for two days, it's dishwasher safe, which is a big plus (Who has time for hand washing?), Its easy to drink from. The lid has a rotating cover with three drinking positions. My favorite feature of all, IT FITS IN ALL OF MY CUP HOLDERS!! It fits in the stroller and in the car! With m...",0,0
225,0.151,0.76,0.088,-0.6746,ElissaG,1,False,11/07/2023,Silicone rips with 2 uses,I used this cup 2 times and after hand washing it I left it on the dry rack with other pots and when I picked it up the silicone coating peeled off. I saw some reviews mentioning this but many that had no problems so I figured I would try it out and hand wash.. nope it peeled within 7 days of arriving to my house. Very disappointed.,0,0
226,0.0,0.781,0.219,0.9741,TessahC,5,False,01/02/2023,Overall very happy with purchase.,"It took me weeks to decide to buy this, and my husband finally did just so I would drink more water. He's right! I don't put anything out water in it and I love it. The only issue is that the bottom matte coating likes to scratch off if you put it in certain cup holders so I'm looking for a silicone sleeve to fit the bottom. I love the color and the feel and I drink more water than before. Overall Im happy and actually looking to buy my husband one as well once they're restocked in the color he'd like!",0,0
227,0.062,0.891,0.047,-0.0798,CrystalG,1,False,13/02/2023,Matte Paint Chips off,"I bought two of these Soft Matte Stanley's and on the first day of use the paint chipped off with just regular use. They do not even look decent to continue using. This happened to both of the cups, since one I bought for my husband and the other for myself. I do not recommend buying any of the Soft Matte cups, after waiting forever for them to become available, to have them already chipping on the first day of use was a great disappointment.",0,0
228,0.0,0.89,0.11,0.6988,CrystalF,5,False,23/02/2023,Love It So Far & Great Color,"I got the new Shale color (no filter or enhancements on my photo). This is my first Stanley Quencher, and I love it like I knew I would! The color is definitely more blue than it appears on the website. I haven't had any issues with coating/color chipping, but this is just day one. It's smooth/silky to touch and feels high quality. 5 stars!",0,0
229,0.0,0.676,0.324,0.9719,JessiJ,3,False,28/05/2023,Bummed over this Beauty…,"LOVE ME SOME STANLEY!! 
However this soft matte edition was a gift to a friend for her first Mother's Day. She was thrilled and loves it!! However, it hasn't held up to the stan-standards, chipping and bubbling after washing, normal hand washing.  Bummed this happened as I am a repeat customer and rave about your products.",0,0
230,0.0,0.779,0.221,0.9169,lillianh,4,False,27/02/2023,It is chipping 😔,"The water bottle is very nice and keeps my ice cold for a long time period. I also love how much water it holds. However, the silicone cover is chipping at the bottom and it makes it look really cheap. I love the color, but I wish I had not purchased the soft matte because it chips too easily.",0,0
231,0.032,0.849,0.119,0.8573,AndrewL,2,False,14/03/2023,Great cup horrible finishing.,The Cup itself is great to keep things cold or hot for a long time which I like and the fact that it fits in the cup holder of almost any car is fantastic. But the finish on mine has started to chip away and peel off and I haven't even been using it for 5 days it has only been hand washed lightly and there is so much tipping on it which makes me worry about the Integrity of the rest of the cup. Maybe just buy one without a finish and the raw metal and it would be a five star for me. But the chipping after 4 or 5 days seems extremely cheap.,0,0
232,0.0,0.756,0.244,0.9586,Ktice,5,False,02/12/2022,Love!,"[This review was collected as part of a promotion.] Absolutely love this tumbler. The size is great. It fits in most cup holders, and you don't have to refill all day long. It keeps your drink cold for days. I really appreciate the improved seals on the lid, too. 
The color and matte finish is really nice. I have already bought more for gifts.",0,0
233,0.268,0.563,0.169,-0.3167,Bennywafer,2,False,02/10/2023,handle broke,"my handle broke off after three months, i loved it up until this point. i'm very disappointed",0,0
234,0.0,0.752,0.248,0.4522,NicoleH,5,False,29/07/2023,Overhype,"Very durable, I just wish the ice would stay a litter longer",0,0
235,0.0,0.826,0.174,0.4111,JeseniaM,2,False,12/09/2023,Staring to peel,I absolutely love my cup but now its starting to peel im so bummed out,0,0
236,0.0,0.678,0.322,0.6458,LatonyaH,5,False,31/07/2023,Husband loves his new Stanley!,Speedy delivery! High quality! My husband is enjoying his cup!❤️,0,0
237,0.0,1.0,0.0,0.0,AlyssaC,1,False,25/08/2023,Disappointed,Matte coating is peeling off after a few months of having it,0,0
238,0.0,0.466,0.534,0.6792,ChrisC,5,False,16/09/2023,Zero buyer's remorse!,Outstanding quality!  Performance beyond expectations!,0,0
239,0.0,1.0,0.0,0.0,TessaK,2,False,23/07/2023,Avoid the matte,Matte coating is peeling off already and I've had my Stanley cup 3 months.,0,0
240,0.0,0.676,0.324,0.5905,MichaelK,1,False,27/08/2023,"I like it,  but…",Chipped within the first week!  But I still like it!,0,0
241,0.0,0.466,0.534,0.9274,ElyssaG,5,False,13/10/2023,Love,Love love love. The soft matte is a must. This thing goes with me everywhere.,0,0
242,0.303,0.528,0.168,-0.4659,Kelleym,2,False,11/08/2023,Don't recommend this material,"Cup itself is great, but the paint chips very badly",0,0
243,0.0,0.548,0.452,0.765,Klaleigh,4,False,04/08/2023,Great cup,Love the color and feel however the matte chips easily.,0,0
244,0.0,0.874,0.126,0.3182,sue,5,True,21/02/2024,Love the handle and how it keeps ice frozen,Never have to refill with ice we do a lot of bike riding and it sure is handy,0,0
245,0.18,0.581,0.238,0.25,jayloveyou2,4,True,03/01/2024,It's a Stanley!,Overall tumbler is great however the seller gave me the wrong straw.,0,0
246,0.268,0.732,0.0,-0.296,Sissy,2,True,10/01/2024,Stanley Adventure THE QUENCHER H.20 FLOWSTATE TUMB,Did not receive proper order. No straw.,0,0
247,0.0,0.615,0.385,0.3612,Jeremy,5,True,14/02/2024,its a cup!,works like a cup should work,0,0
248,0.0,0.656,0.344,0.6369,Julie,5,True,10/03/2024,Love Dawn Sure Adds smiles to my families' faces.,Love this Dish Soap. My Whole Family Uses It.,0,0
249,0.33,0.472,0.198,-0.3384,teresa,3,True,17/02/2024,Stanley,Doesn't hold ice that well very disappointing,0,0
250,0.0,0.949,0.051,0.2263,MadisonM,2,False,18/12/2022,Ok but needs improvement,The style and the size of the cup in nice but it barely holds ice for long and the bottom of it the paint has already chipped and I've only had it for a month or so.,0,0
251,0.0,0.937,0.063,0.4005,KelseyB,3,False,27/02/2023,Mehh.,I was so excited to get this cup because of the color and the matte finish. After purchasing it started to chip away at the bottom and scratch where the color would come off. I would think for the price that wouldn't happen. 🙃,0,0
252,0.112,0.824,0.064,-0.4602,MillennialMom,1,False,30/12/2022,Stay Away from the Matte Finish,I really wanted to love this but the matte finish is just not practical. I've used my bottle for less than a week (received as a Christmas gift) and the finish on the bottom is already peeling/chipping off. Very disappointing.,0,0
253,0.028,0.716,0.256,0.9259,LoisK,5,False,17/12/2022,Love Stanley Quenchers,I love the Soft Matte finish.  Would love to also get it in 30oz size.  Hard to find that one. I love to fill it with Chick filet ice and then just add water and it stays cold all day and night!,0,0
254,0.0,0.853,0.147,0.7743,Jordyn,5,False,21/02/2023,So pretty,I just got my Stanley today & it is beautiful. I noticed some reviews saying that the lid & color are off but mine is the same color as the cup. I really hope the finish doesn't start to chip though with how expensive these are.,0,0
255,0.124,0.758,0.119,-0.071,LeahRE,3,False,19/11/2022,"Nice, but I don't recommend for pet owners","The cup is great, but I would not recommend it to anyone with a pet. The soft matte finish attracts hair. I have two dogs that shed. The dog hair (plus the static from the dry, winter air) sticks to the cup and it's kinda unpleasant.",0,0
256,0.113,0.653,0.234,0.5336,sky1234,2,False,30/12/2022,Chipping/ Peeling,"Don't get me wrong, I LOVE my stanley cups, but i was disappointed with the soft matte. These are suppose to be dishwasher safe, but after 2 washes mine started chipping/peeling.",0,0
257,0.19,0.667,0.143,-0.3037,TristonO,5,False,25/02/2023,Loooooove it,"I was cautious about ordering the matte just because of all the reviews saying the matte comes off, but I haven't had any problems with it yet. I absolutely looooove it! No damages and keeps everything cold! Also soooo cute!",0,0
258,0.046,0.741,0.213,0.875,KarlaD,3,False,18/03/2023,Overall ok,I love my Stanley tumbler. The handle is very convenient and the size is great. My one complain is that soft matte skin has began to split open after two months of use. This cup has only ever been hand washed and handled with love:(,0,0
259,0.0,0.897,0.103,0.4939,JessicaS,1,False,19/06/2023,Don't get it,Don't get the matte. I've had it for less than 2 months and the bottom is already flaking off. I've never put it in the dishwasher either only hand washed.,0,0
260,0.0,0.877,0.123,0.6369,MarianneN,3,False,13/03/2023,Soft touch finish is not durable,"Love Stanley cups, have several colors.  However, it seems that the soft touch is not nearly as durable as regular finish.  After half a dozen uses the bottom edge is all chipped.",0,0
261,0.133,0.675,0.192,0.2691,DavidR129301565,3,False,05/03/2023,Disappointed,Love this cup so much but the peeling factor on the matte is really disappointing!!! Especially because of the price of these are more than the original.,0,0
262,0.0,0.812,0.188,0.7574,CaleighS,1,False,21/03/2023,Matte finish PEELING OFF,The matte finish started peeling off after following all care instructions and treating it very gently. I've only had it for 3 weeks & I can't even get a message back from customer service 🥲,0,0
263,0.032,0.771,0.197,0.8684,LindsayC,5,False,16/02/2023,Get one 💯,Love it! Obsessed! Stays so cold for so long. And it's nice having the extra water vs. the 30oz Yeti I've used for the last couple of years. And better than my 40oz Hydroflask because this actually fits in my cup holder in the car.,0,0
264,0.223,0.651,0.126,-0.562,MaggieH,1,False,17/01/2023,This finish chips!,The finish has started chipping after 2 weeks of use. I'm honestly disappointed and shocked in the poor quality of a product that has received so many compliments. I have the regular finish and have not experienced anything like this.,0,0
265,0.198,0.7,0.103,-0.7461,BrittanyS,1,False,25/02/2023,Matte finish defect,"I purchased in January and have only hand washed twice and the matte finish is coming off. I love my cup but every time I try to submit a damage claim or warranty claim, the site shuts down. Very disappointing.",0,0
266,0.079,0.723,0.198,0.7631,MacfromCO,1,False,29/05/2023,Don't get the matte!,"Look this is an awesome cup, fits great in my cars cup holder and love the handle. SADLY it chips. A lot. They are replacing my cup but don't have an ETA on when and can't guarantee the same color. I would recommend trying the not matte one.",0,0
267,0.126,0.74,0.134,0.092,KimberleighH,3,False,22/05/2023,Finish not durable,"The color is beautiful (orchid) but there were tears in the coating within one week of use. The feel of the bottle is nice, but I'm not confident in the long term wear compared to the other finishes.",0,0
268,0.0,0.889,0.111,0.6249,JaniceM,3,False,27/12/2022,"Great cup, not so great outer coating","Great cup. Keeps my water really cold for a long time. After a couple days of use, the outside coating started chipping off. For as much as I paid for the cup, it should be more durable.",0,0
269,0.0,0.753,0.247,0.7825,KristinJ,3,False,29/03/2023,"Beautiful color, quick to chip...","I LOVED this tumbler when it first came. Beautiful color, I really wanted to continue to love it but it chipped quite fast. I have only had it since mid-January.",0,0
270,0.0,0.872,0.128,0.6908,KelliE,2,False,25/05/2023,Don't get the matte finish you,I love the Stanley tumbler but don't get the matte finish.  I purchased two of them and both had a few tiny bubbles that popped and left small pin holes. Also the material is easily scratched.  My next Stanley will be the non-matte finish.,0,0
271,0.0,0.825,0.175,0.7311,kristens,4,False,26/01/2023,Great cup—not the color I was expecting!,"Love the actual cup, but the color in person is way more blue. Maybe I'm colorblind, but definitely saw it as more green in the photo. Not quite navy, but close.",0,0
272,0.0,0.871,0.129,0.5569,EvelynO,3,False,08/03/2023,Matte peals,I really liked mine and the handle is great but the matte is peal on the edges and it just continues to peak with time. I've only had it about 2 weeks so we'll See.,0,0
273,0.049,0.881,0.069,0.1901,GinaZ,3,False,09/02/2023,40oz Cup,"I love this cup….The only problem i have is the color is starting to chip and it doesn't not keep my ice for long, the cup will keep my water cold but won't keep my the ice.",0,0
274,0.134,0.79,0.076,-0.4569,TeacherMom,3,False,19/12/2022,Already peeling,Love Stanley's 40oz quencher (I own three) but I'm very disappointed in the quality of the soft matte finish. Mine is already peeling off after a month of light use.,0,0
275,0.086,0.914,0.0,-0.4417,MeganC,2,False,11/05/2023,Not worth the money,Had for only a month before the matte material the cup is made from started peeling off around the bottom. Didn't expect it to do that for the price they cost. A little disappointing.,0,0
276,0.0,1.0,0.0,0.0,Anna,3,False,22/06/2023,Soft matte chips off,Bought this not realizing “soft matte” meant it was covered in a rubber coating. It has scratched/chipped off in many places. I've only had it a month and a half. Had I known it was covered in this rubber I would have gotten something different.,0,0
277,0.0,0.872,0.128,0.743,AngieF,3,False,12/03/2023,Beware of Soft Matte Coating,"I wanted to love this tumbler. 
I leaks. It is not a vacuum seal.
My bigger issue is the soft matte coating chips off with the slightest of bump. My mug sits on a desk most of the day, and the bottom is chipped, as well as the side.",0,0
278,0.0,0.81,0.19,0.714,BritniG,4,False,17/05/2023,Want to Love!,"I truly want to give this cup 5 stars but the outer finish was not right around the top of the cup when I received it and now, one month of use, it is coming off of the bottom as well.",0,0
279,0.187,0.603,0.21,0.0644,PaigeR,2,False,11/01/2023,Chips way too easily,I love my Stanley cups but this one missed the mark. No matter how careful I am there is nicks all over this water bottle. All which happened right after receiving. Disappointing and won't be buying this kind again anytime soon.,0,0
280,0.058,0.942,0.0,-0.1695,Mollie,3,False,21/02/2023,Not worth the hype,"Do not wash in dishwasher. The material will come off. Got it Friday, washed it before use and the material already came off. Def not worth the money.",0,0
281,0.171,0.607,0.222,0.6117,Kimbo,2,False,20/02/2023,Matte is not where it's at,"I love this cup so much! I wish I didn't get the matte though, I hand wash and the wear on the bottom is disappointing. Would NOT recommend the matte as it peels off like mad and I've only had it a month-for the price it's not worth it.",0,0
282,0.086,0.645,0.269,0.8924,AngelaM,3,False,08/03/2023,Handle is a different color than cup,I love this cup!  Easy to clean. Does a great job of keeping my ice all day. My complaint is that the handle is a different color than the cup itself and is very noticeable. Just doesn't look as nice in my opinion.,0,0
283,0.0,0.7,0.3,0.8908,KaitlynS,3,False,19/07/2023,Matte scratches off,"Cup is great, matte coating not so much. It scratches off fairly easy and I'm very careful with it. Definitely showing wear where it hits my cup holder in the car",0,0
284,0.0,0.75,0.25,0.8398,ChristiN,5,False,26/06/2023,Stanley 40oz,"I love my Stanley tumblers, especially the soft matte.  As a nurse, it's important to me that my water stays cold during my 12 hour shifts, and Stanley definitely delivers on that!",0,0
285,0.0,0.827,0.173,0.7871,BrianaT,5,False,01/03/2023,Absolutely love,I use this cup every day! Day in and out. I love how easy it is to hit not only my hydration goals but above them. It easily fits in my work vehicle or personal vehicle and holds ice for a very long time.,0,0
286,0.071,0.671,0.258,0.8363,EmilyE,1,False,30/06/2023,Not up to par,"After only hand washing and taking great care of the cup, the top matte layer is starting to peel and show the aluminum body underneath. Very disappointed. Also ice is only lasting about 6 hours in the cup",0,0
287,0.077,0.819,0.104,0.2732,AshleyB,4,False,28/02/2023,Love but a flaw,I got this cup in the beginning of January. I use it every day. I love the matte blue. My only issue is that it is putting on the base. I'm sad that the matte isn't more durable.,0,0
288,0.135,0.669,0.195,0.437,SarahT,2,False,09/07/2023,Not worth the hype,"Absolutely, positively not worth the hype friends. The matte finish looks fantastic, but it wears off just from putting it in a car cupholder. You may as well forget it if you drop it as far as wear and tear.",0,0
289,0.0,0.587,0.413,0.9623,LindseyB,5,False,21/12/2022,Great cup,Bought this so I could drink more water while at work. Love that it fits in my cars cup holder. The matte feel is super nice and easy to clean. A pretty cup that stays cold,0,0
290,0.0,0.854,0.146,0.7178,SamanthaH,3,False,05/03/2023,Matte finish not sturdy,Great cup. Matte finish isn't very sturdy from what I can tell. I have been very careful with my cup and it still has a chip in the paint. I haven't had it for more than a month with very light use. 👎,0,0
291,0.093,0.762,0.146,0.533,AndreaW,3,False,18/01/2023,Weird - Two colors,"Love this in concept but WHY is the handle and lid a different color (dusty rose) than the mug itself???  It's weird.  I wish the whole thing was dusty rose, or Dune but the two-tone is strange and NOT AS DESCRIBED.",0,0
292,0.0,0.796,0.204,0.8745,AbbieH,5,False,18/03/2023,I'm a cool teacher now!,"I purchased the blue matte 40oz, and it's been the best water bottle I've ever had. I have not had any issues with the matte finish chipping, like others have mentioned. I feel so cool because I was able to get my Stanley before my students!",0,0
293,0.047,0.648,0.305,0.9266,AbbyR,4,False,25/02/2023,You need to get this color,this was a PERFECT color for me!! One this is that you held it back another week. Shale is so nice. With the other reviews I heard my bottle came nothing like that. PERFECT BOTTLE!!!,0,0
294,0.0,0.634,0.366,0.936,JAIMIEK,3,False,11/11/2022,PAINT CHIPS OFF.,"I love the color of this one, but after 3 weeks the paint is already chipping off the cup. Super bummed because these are beautiful and are expensive...",0,0
295,0.095,0.707,0.198,0.6749,AnaR,3,False,03/03/2023,"Great cup, not the finish",I love this cup but the soft matte finish peels off immediately! It's been less than a month and mine has already started to come off and it make me sad because I love the cup otherwise.,0,0
296,0.203,0.659,0.138,-0.5106,LindseyM,1,False,19/03/2023,Do NOT buy the matte!,Love the cup but poor quality for the money. The soft matte top coating started chipping immediately. It continues to chip everyday. Faulty product for the money.,0,0
297,0.053,0.86,0.087,0.1779,ColtonL,2,False,24/02/2023,Losing finish,"It's a soft touch exterior which is super nice but shortly after receiving it the bottom started to literally flake off and is exposing bare metal, just setting this down causes this? Other than that it keeps ice for as long as my wife would need it",0,0
298,0.157,0.794,0.049,-0.719,Stephaniew,3,False,26/06/2023,Feel cool but the material will peel and chip sadly,All soft matt have stuff stick to them all the time and they peel so much and chip very easily. I only claimed one for I don't wanna. Keep making claims and I don't wanna use the other soft Matt cups to much because of fear it then being ruined :/,0,0
299,0.051,0.771,0.177,0.7097,CLD75,3,False,14/02/2023,Buy the cheaper one,Love the soft velvet feel of the matte finish but I've only had it 2 weeks and it is already peeling away.  Never been dropped and always hand washed.  Not worth the extra money.,0,0
300,0.129,0.63,0.242,0.7684,TianaT,2,False,28/02/2023,Not great quality for the price,I like this cup but after only a little over a month the soft matte outside is chipping off everywhere. I'm pretty gentle with this cup too and only hand wash it and use it around the house for water. Not super impressed considering the price,0,0
301,0.056,0.814,0.13,0.4404,KaylaA,3,False,24/02/2023,Color not as pictured,"I was all excited for the new ""shale"" color, however when it arrived it's definitely not the teal-ish color it appears in the pictures. It's more of a medium gray. No blue hues in it at all.",0,0
302,0.097,0.845,0.059,-0.1586,SavannaW,3,False,27/02/2023,Don't go for soft matte :/,"Soft matte coating started peeling I'm scared to even put the cup in my car cup holder cause I don't want it to chip even more than it already peeled, other than that it's a 10/10 I would just recommend a different coating",0,0
303,0.0,0.786,0.214,0.8779,MorganM,2,False,27/12/2022,Only for looks,I love the cup…it's pretty and keeps my drinks cold. But…after the first run on the treadmill the matte coating came off from being put in the cup holder. The cup is definitely for looks and not built for actual use….,0,0
304,0.113,0.627,0.26,0.6597,LT,2,False,14/03/2023,Chipped quickly,"Chipped very shortly after getting it. Love everything else, but disappointed in this since I hadn't even put it in the dishwater and took care of it well.",0,0
305,0.038,0.7,0.262,0.8805,BiancaO,5,False,19/12/2022,Best big mug,"I love the Oz really makes it count when I want to make sure I stay hydrated during my work day, in any days I forget to get up when I'm hyper concentrated and having this here full and ready really supports my liquid intake.",0,0
306,0.082,0.918,0.0,-0.395,KenleeC,3,False,19/07/2023,Cute but is it work it,My has chipped all over the bottom and across the front and back on manny places I live it over all but do not recommend this specific matte material of the cup,0,0
307,0.0,1.0,0.0,0.0,JasonW,3,False,12/07/2023,Usage.,"Keeps drinks very cold, but for the price I would t expect the color to come off the cup. Both of them that I purchased are having the exterior color chip off.",0,0
308,0.0,0.823,0.177,0.7696,MichelleH,1,False,20/02/2023,"For the price, the quality sucks in workmanship. Come on Stanley.",I've barely had it a full month. I'm super careful with it! I just now touched the side of it with my finger and the coating fell right off in two spots. What the heck!!!!!,0,0
309,0.0,0.497,0.503,0.9729,TristaW,5,False,04/01/2023,Red Rust Love,"Love love love this tumbler! I love everything about this tumbler, the color, how it fits in my vehicle cup holder and the tumbler is ergonomic. I would definitely recommend.",0,0
310,0.0,0.939,0.061,0.3818,AlisonR,4,False,28/06/2023,Soft matte scuffs and tears,"I love this cup and it keeps everything cold, but I have never dropped it. Put it in a cup holder, and when I took it out there were scuffs and marks all over the side of the cup.  Now my cup looks beat up.",0,0
311,0.063,0.887,0.05,-0.1645,AmandaS,2,False,20/12/2022,First disappointment,I have about 5 Stanley cups this size (40oz) and this is the first one that has some type of damage to it after only having it for a month. The coating on this matte tumbler has chipped/peeled away and now I don't use it so it doesn't get any worse.,0,0
312,0.1,0.9,0.0,-0.4585,FaithA,1,False,24/01/2023,Chipping on bottom and side,"I received this cup around Christmas. It is already chipping on the bottom and on the side. I am not happy with this purchase, considering the price of this cup.",0,0
313,0.0,0.7,0.3,0.8904,JaymieT,5,False,31/01/2023,Love these matte cups,This is by far my favorite! It's soft and just everything about it…SMOOTH!! It's durable and holds up well. I was once a Hydroflask user. Though I've definitely made a turn for the better.,0,0
314,0.07,0.764,0.166,0.5256,michelles,1,False,21/06/2023,Save the extra $ and don't get soft matte.,Knicks and scratches very easily. I even purchased a boot for the bottom to prevent from damage. All my other Stanley's are in amazing condition and I've had them forever. This is my first soft matte and i won't be purchasing another.,0,0
315,0.0,0.708,0.292,0.9541,MarthaR,5,False,19/03/2023,my Stanley,Love it my husband bought this one for me . I had been looking for them ever since I bought my daughter on for Christmas.. it's so easy to fit this cup in my cars cup holder…. My yeti's don't fit so glad I got this Stanley will buy other colors.,0,0
